{
  "$schema": "https://json-schema.org/draft/2020-12/schema",
  "$id": "https://mooncraft.dev/runtime-protocol/builtin-runtime.v3.schema.json",
  "title": "MoonCraft Built-in Runtime v3",
  "type": "object",
  "additionalProperties": false,
  "required": ["name", "enabled", "is_default", "spec"],
  "properties": {
    "name": {
      "type": "string",
      "minLength": 1
    },
    "enabled": {
      "type": "boolean"
    },
    "is_default": {
      "type": "boolean"
    },
    "spec": {
      "$ref": "./runtime-manifest.v3.schema.json"
    }
  }
}
