{
  "name": "Codex",
  "enabled": true,
  "is_default": true,
  "spec": {
    "protocol_version": 2,
    "image": "docker.io/moonbitcloud/mooncraft-agent-runtime:0.3.2",
    "agent": "codex",
    "model": "openai/gpt-5.4-mini",
    "auth": {
      "kind": "openrouter_api_key",
      "secret": {
        "source": "mooncraft_ai_api_key",
        "target": {
          "type": "env",
          "name": "MOONCRAFT_AI_API_KEY"
        }
      }
    }
  }
}
